{
    "meta": {
        "protocol_version": "1.0.0",
        "schema_version": "1.0.0",
        "created_at": "2025-12-01T12:01:00.000Z"
    },
    "trace_id": "550e8400-e29b-41d4-a716-446655440550",
    "context_id": "550e8400-e29b-41d4-a716-446655440500",
    "plan_id": "550e8400-e29b-41d4-a716-446655440501",
    "root_span": {
        "trace_id": "550e8400-e29b-41d4-a716-446655440550",
        "span_id": "550e8400-e29b-41d4-a716-446655440551"
    },
    "status": "completed",
    "started_at": "2025-12-01T12:01:00.000Z",
    "finished_at": "2025-12-01T12:15:00.000Z",
    "events": [
        {
            "event_id": "550e8400-e29b-41d4-a716-446655440560",
            "event_type": "confirm.submitted",
            "source": "confirm",
            "timestamp": "2025-12-01T12:01:00.000Z",
            "trace_id": "550e8400-e29b-41d4-a716-446655440550",
            "data": {
                "confirm_id": "550e8400-e29b-41d4-a716-446655440520",
                "target_id": "550e8400-e29b-41d4-a716-446655440501",
                "target_type": "plan"
            }
        },
        {
            "event_id": "550e8400-e29b-41d4-a716-446655440561",
            "event_type": "decision.rejected",
            "source": "confirm",
            "timestamp": "2025-12-01T12:05:00.000Z",
            "trace_id": "550e8400-e29b-41d4-a716-446655440550",
            "data": {
                "confirm_id": "550e8400-e29b-41d4-a716-446655440520",
                "decision_id": "550e8400-e29b-41d4-a716-446655440521",
                "reason": "Missing rollback plan for high-risk migration"
            }
        },
        {
            "event_id": "550e8400-e29b-41d4-a716-446655440562",
            "event_type": "decision.approved",
            "source": "confirm",
            "timestamp": "2025-12-01T12:15:00.000Z",
            "trace_id": "550e8400-e29b-41d4-a716-446655440550",
            "data": {
                "confirm_id": "550e8400-e29b-41d4-a716-446655440520",
                "decision_id": "550e8400-e29b-41d4-a716-446655440522",
                "reason": "Rollback addressed"
            }
        }
    ]
}